----------------------------------------------------------------------------
CrystalDiskInfo 9.1.1 (C) 2008-2023 hiyohiyo
                                Crystal Dew World: https://crystalmark.info/
----------------------------------------------------------------------------

    OS : Windows 10 Professional [10.0 Build 19045] (x64)
  Date : 2025/04/10 8:46:06

-- Controller Map ----------------------------------------------------------
 - Контроллер дискового пространства (Майкрософт) [SCSI]
 + Стандартный контроллер NVM Express [SCSI]
   - KIOXIA-EXCERIA G2 SSD
 - RAID-контроллер SATA для набора микросхем Intel [SCSI]

-- Disk List ---------------------------------------------------------------
 (01) KIOXIA-EXCERIA G2 SSD : 500,1 GB [0/1/0, sq] - nv

----------------------------------------------------------------------------
 (01) KIOXIA-EXCERIA G2 SSD
----------------------------------------------------------------------------
           Model : KIOXIA-EXCERIA G2 SSD
        Firmware : ECFA17.1
   Serial Number : 347A20X2K71S
       Disk Size : 500,1 GB
       Interface : NVM Express
        Standard : NVM Express 1.3
   Transfer Mode : PCIe 3.0 x4 | PCIe 3.0 x4
  Power On Hours : 116 ч
  Power On Count : 10 раз
      Host Reads : 4137 GB
     Host Writes : 4203 GB
     Temperature : 46 C (114 F)
   Health Status : Хорошо (99 %)
        Features : S.M.A.R.T., TRIM, VolatileWriteCache
    Drive Letter : C:

-- S.M.A.R.T. --------------------------------------------------------------
ID RawValues(6) Attribute Name
01 000000000000 Критическое предупреждение
02 00000000013F Составная температура
03 000000000064 Доступный запас
04 000000000005 Порог доступного запаса
05 000000000001 Процент использования
06 0000008464B7 Единицы данных - чтение
07 000000867F88 Единицы данных - запись
08 0000009B5FE5 Команды хост-чтения
09 000000A68CBC Команды хост-записи
0A 000000000068 Время работы контроллера
0B 00000000000A Включения/отключения
0C 000000000074 Часы работы
0D 000000000002 Небезопасные отключения
0E 000000000000 Ошибки целостности носителя и данных
0F 000000000171 Записи в журнале информации об ошибках

-- IDENTIFY_DEVICE ---------------------------------------------------------
        0    1    2    3    4    5    6    7    8    9
000: 1E0F 1E0F 3433 4137 3032 3258 374B 5331 2020 2020
010: 2020 2020 494B 584F 4149 452D 4358 5245 4149 4720
020: 2032 5353 2044 2020 2020 2020 2020 2020 2020 2020
030: 2020 2020 4345 4146 3731 312E 8E01 8CE3 0900 0001
040: 0300 0001 9680 0098 9680 0098 0200 0000 0002 0000
050: 0000 0000 0000 0000 0000 0000 0000 0000 0000 0000
060: 0000 0000 0000 0000 0000 0000 0000 0000 0000 0000
070: 0000 0000 0000 0000 0000 0000 0000 0000 0000 0000
080: 0000 0000 0000 0000 0000 0000 0000 0000 0000 0000
090: 0000 0000 0000 0000 0000 0000 0000 0000 0000 0000
100: 0000 0000 0000 0000 0000 0000 0000 0000 0000 0000
110: 0000 0000 0000 0000 0000 0000 0000 0000 0000 0000
120: 0000 0000 0000 0000 0000 0000 0000 0000 0017 0303
130: 0A12 043E 0101 0159 016B 0064 0000 0000 0000 0000
140: 6000 70C0 0074 0000 0000 0000 0000 0000 0000 0000
150: 0000 0000 0000 0000 0000 0000 0000 0000 000A 0100
160: 0000 0001 0143 015F 0000 0000 0000 0000 0000 0000
170: 0000 0000 0000 0000 0000 0000 0000 0000 0000 0000
180: 0000 0000 0000 0000 0000 0000 0000 0000 0000 0000
190: 0000 0000 0000 0000 0000 0000 0000 0000 0000 0000
200: 0000 0000 0000 0000 0000 0000 0000 0000 0000 0000
210: 0000 0000 0000 0000 0000 0000 0000 0000 0000 0000
220: 0000 0000 0000 0000 0000 0000 0000 0000 0000 0000
230: 0000 0000 0000 0000 0000 0000 0000 0000 0000 0000
240: 0000 0000 0000 0000 0000 0000 0000 0000 0000 0000
250: 0000 0000 0000 0000 0000 0000

-- SMART_NVME --------------------------------------------------------------
     +0 +1 +2 +3 +4 +5 +6 +7 +8 +9 +A +B +C +D +E +F
000: 00 3F 01 64 05 01 00 00 00 00 00 00 00 00 00 00
010: 00 00 00 00 00 00 00 00 00 00 00 00 00 00 00 00
020: B7 64 84 00 00 00 00 00 00 00 00 00 00 00 00 00
030: 88 7F 86 00 00 00 00 00 00 00 00 00 00 00 00 00
040: E8 5F 9B 00 00 00 00 00 00 00 00 00 00 00 00 00
050: BC 8C A6 00 00 00 00 00 00 00 00 00 00 00 00 00
060: 68 00 00 00 00 00 00 00 00 00 00 00 00 00 00 00
070: 0A 00 00 00 00 00 00 00 00 00 00 00 00 00 00 00
080: 74 00 00 00 00 00 00 00 00 00 00 00 00 00 00 00
090: 02 00 00 00 00 00 00 00 00 00 00 00 00 00 00 00
0A0: 00 00 00 00 00 00 00 00 00 00 00 00 00 00 00 00
0B0: 71 01 00 00 00 00 00 00 00 00 00 00 00 00 00 00
0C0: 00 00 00 00 00 00 00 00 00 00 00 00 00 00 00 00
0D0: 00 00 00 00 00 00 00 00 12 00 00 00 00 00 00 00
0E0: 62 1D 00 00 00 00 00 00 00 00 00 00 00 00 00 00
0F0: 00 00 00 00 00 00 00 00 00 00 00 00 00 00 00 00
100: 00 00 00 00 00 00 00 00 00 00 00 00 00 00 00 00
110: 00 00 00 00 00 00 00 00 00 00 00 00 00 00 00 00
120: 00 00 00 00 00 00 00 00 00 00 00 00 00 00 00 00
130: 00 00 00 00 00 00 00 00 00 00 00 00 00 00 00 00
140: 00 00 00 00 00 00 00 00 00 00 00 00 00 00 00 00
150: 00 00 00 00 00 00 00 00 00 00 00 00 00 00 00 00
160: 00 00 00 00 00 00 00 00 00 00 00 00 00 00 00 00
170: 00 00 00 00 00 00 00 00 00 00 00 00 00 00 00 00
180: 00 00 00 00 00 00 00 00 00 00 00 00 00 00 00 00
190: 00 00 00 00 00 00 00 00 00 00 00 00 00 00 00 00
1A0: 00 00 00 00 00 00 00 00 00 00 00 00 00 00 00 00
1B0: 00 00 00 00 00 00 00 00 00 00 00 00 00 00 00 00
1C0: 00 00 00 00 00 00 00 00 00 00 00 00 00 00 00 00
1D0: 00 00 00 00 00 00 00 00 00 00 00 00 00 00 00 00
1E0: 00 00 00 00 00 00 00 00 00 00 00 00 00 00 00 00
1F0: 00 00 00 00 00 00 00 00 00 00 00 00 00 00 00 00

